{
  "kind": "comparison",
  "schemaVersion": "1.0",
  "leftSnapshot": "043e95d64e6cd448c7af6a6119711ec06802d8dcda075c8e96241b9f7b84e9ad",
  "rightSnapshot": "ded4bd7d8fef7c96c91246a0116dd963b37b1deb5c3ff88949ca8fb0f936638a",
  "matches": [
    {
      "id": "match:model/tokens",
      "left": [
        "model/tokens"
      ],
      "right": [
        "model/tokens"
      ],
      "status": "suggested",
      "origin": "rule",
      "reason": "作用域位置、角色和静态调用结构对应；建议不是等价证明"
    },
    {
      "id": "match:model/embedding",
      "left": [
        "model/embedding"
      ],
      "right": [
        "model/embedding"
      ],
      "status": "suggested",
      "origin": "rule",
      "reason": "作用域位置、角色和静态调用结构对应；建议不是等价证明"
    },
    {
      "id": "match:model/blocks.0",
      "left": [
        "model/blocks.0"
      ],
      "right": [
        "model/blocks.0"
      ],
      "status": "suggested",
      "origin": "rule",
      "reason": "作用域位置、角色和静态调用结构对应；建议不是等价证明"
    },
    {
      "id": "match:blocks.0/x",
      "left": [
        "blocks.0/x"
      ],
      "right": [
        "blocks.0/x"
      ],
      "status": "suggested",
      "origin": "rule",
      "reason": "作用域位置、角色和静态调用结构对应；建议不是等价证明"
    },
    {
      "id": "match:blocks.0/norm1",
      "left": [
        "blocks.0/norm1"
      ],
      "right": [
        "blocks.0/norm1"
      ],
      "status": "suggested",
      "origin": "rule",
      "reason": "作用域位置、角色和静态调用结构对应；建议不是等价证明"
    },
    {
      "id": "match:blocks.0/attention",
      "left": [
        "blocks.0/attention"
      ],
      "right": [
        "blocks.0/attention"
      ],
      "status": "suggested",
      "origin": "rule",
      "reason": "作用域位置、角色和静态调用结构对应；建议不是等价证明"
    },
    {
      "id": "match:blocks.0.attention/x",
      "left": [
        "blocks.0.attention/x"
      ],
      "right": [
        "blocks.0.attention/x"
      ],
      "status": "suggested",
      "origin": "rule",
      "reason": "作用域位置、角色和静态调用结构对应；建议不是等价证明"
    },
    {
      "id": "match:blocks.0.attention/q_proj",
      "left": [
        "blocks.0.attention/q_proj"
      ],
      "right": [
        "blocks.0.attention/q_proj"
      ],
      "status": "suggested",
      "origin": "rule",
      "reason": "作用域位置、角色和静态调用结构对应；建议不是等价证明"
    },
    {
      "id": "match:blocks.0.attention/q_reshape",
      "left": [
        "blocks.0.attention/q_reshape"
      ],
      "right": [
        "blocks.0.attention/q_reshape"
      ],
      "status": "suggested",
      "origin": "rule",
      "reason": "作用域位置、角色和静态调用结构对应；建议不是等价证明"
    },
    {
      "id": "match:blocks.0.attention/q_transpose",
      "left": [
        "blocks.0.attention/q_transpose"
      ],
      "right": [
        "blocks.0.attention/q_transpose"
      ],
      "status": "suggested",
      "origin": "rule",
      "reason": "作用域位置、角色和静态调用结构对应；建议不是等价证明"
    },
    {
      "id": "match:blocks.0.attention/k_proj",
      "left": [
        "blocks.0.attention/k_proj"
      ],
      "right": [
        "blocks.0.attention/k_proj"
      ],
      "status": "suggested",
      "origin": "rule",
      "reason": "作用域位置、角色和静态调用结构对应；建议不是等价证明"
    },
    {
      "id": "match:blocks.0.attention/k_reshape",
      "left": [
        "blocks.0.attention/k_reshape"
      ],
      "right": [
        "blocks.0.attention/k_reshape"
      ],
      "status": "suggested",
      "origin": "rule",
      "reason": "作用域位置、角色和静态调用结构对应；建议不是等价证明"
    },
    {
      "id": "match:blocks.0.attention/k_transpose",
      "left": [
        "blocks.0.attention/k_transpose"
      ],
      "right": [
        "blocks.0.attention/k_transpose"
      ],
      "status": "suggested",
      "origin": "rule",
      "reason": "作用域位置、角色和静态调用结构对应；建议不是等价证明"
    },
    {
      "id": "match:blocks.0.attention/v_proj",
      "left": [
        "blocks.0.attention/v_proj"
      ],
      "right": [
        "blocks.0.attention/v_proj"
      ],
      "status": "suggested",
      "origin": "rule",
      "reason": "作用域位置、角色和静态调用结构对应；建议不是等价证明"
    },
    {
      "id": "match:blocks.0.attention/v_reshape",
      "left": [
        "blocks.0.attention/v_reshape"
      ],
      "right": [
        "blocks.0.attention/v_reshape"
      ],
      "status": "suggested",
      "origin": "rule",
      "reason": "作用域位置、角色和静态调用结构对应；建议不是等价证明"
    },
    {
      "id": "match:blocks.0.attention/v_transpose",
      "left": [
        "blocks.0.attention/v_transpose"
      ],
      "right": [
        "blocks.0.attention/v_transpose"
      ],
      "status": "suggested",
      "origin": "rule",
      "reason": "作用域位置、角色和静态调用结构对应；建议不是等价证明"
    },
    {
      "id": "match:blocks.0.attention/k_repeat",
      "left": [
        "blocks.0.attention/k_repeat"
      ],
      "right": [
        "blocks.0.attention/k_repeat"
      ],
      "status": "suggested",
      "origin": "rule",
      "reason": "作用域位置、角色和静态调用结构对应；建议不是等价证明"
    },
    {
      "id": "match:blocks.0.attention/v_repeat",
      "left": [
        "blocks.0.attention/v_repeat"
      ],
      "right": [
        "blocks.0.attention/v_repeat"
      ],
      "status": "suggested",
      "origin": "rule",
      "reason": "作用域位置、角色和静态调用结构对应；建议不是等价证明"
    },
    {
      "id": "match:blocks.0.attention/k_score_transpose",
      "left": [
        "blocks.0.attention/k_score_transpose"
      ],
      "right": [
        "blocks.0.attention/k_score_transpose"
      ],
      "status": "suggested",
      "origin": "rule",
      "reason": "作用域位置、角色和静态调用结构对应；建议不是等价证明"
    },
    {
      "id": "match:blocks.0.attention/qk_scaled",
      "left": [
        "blocks.0.attention/qk_scaled"
      ],
      "right": [
        "blocks.0.attention/qk_scaled"
      ],
      "status": "suggested",
      "origin": "rule",
      "reason": "作用域位置、角色和静态调用结构对应；建议不是等价证明"
    },
    {
      "id": "match:blocks.0.attention/causal_mask",
      "left": [
        "blocks.0.attention/causal_mask"
      ],
      "right": [
        "blocks.0.attention/causal_mask"
      ],
      "status": "suggested",
      "origin": "rule",
      "reason": "作用域位置、角色和静态调用结构对应；建议不是等价证明"
    },
    {
      "id": "match:blocks.0.attention/masked_scores",
      "left": [
        "blocks.0.attention/masked_scores"
      ],
      "right": [
        "blocks.0.attention/masked_scores"
      ],
      "status": "suggested",
      "origin": "rule",
      "reason": "作用域位置、角色和静态调用结构对应；建议不是等价证明"
    },
    {
      "id": "match:blocks.0.attention/softmax",
      "left": [
        "blocks.0.attention/softmax"
      ],
      "right": [
        "blocks.0.attention/softmax"
      ],
      "status": "suggested",
      "origin": "rule",
      "reason": "作用域位置、角色和静态调用结构对应；建议不是等价证明"
    },
    {
      "id": "match:blocks.0.attention/weighted_sum",
      "left": [
        "blocks.0.attention/weighted_sum"
      ],
      "right": [
        "blocks.0.attention/weighted_sum"
      ],
      "status": "suggested",
      "origin": "rule",
      "reason": "作用域位置、角色和静态调用结构对应；建议不是等价证明"
    },
    {
      "id": "match:blocks.0.attention/context_transpose",
      "left": [
        "blocks.0.attention/context_transpose"
      ],
      "right": [
        "blocks.0.attention/context_transpose"
      ],
      "status": "suggested",
      "origin": "rule",
      "reason": "作用域位置、角色和静态调用结构对应；建议不是等价证明"
    },
    {
      "id": "match:blocks.0.attention/context_merge",
      "left": [
        "blocks.0.attention/context_merge"
      ],
      "right": [
        "blocks.0.attention/context_merge"
      ],
      "status": "suggested",
      "origin": "rule",
      "reason": "作用域位置、角色和静态调用结构对应；建议不是等价证明"
    },
    {
      "id": "match:blocks.0.attention/o_proj",
      "left": [
        "blocks.0.attention/o_proj"
      ],
      "right": [
        "blocks.0.attention/o_proj"
      ],
      "status": "suggested",
      "origin": "rule",
      "reason": "作用域位置、角色和静态调用结构对应；建议不是等价证明"
    },
    {
      "id": "match:blocks.0.attention/output",
      "left": [
        "blocks.0.attention/output"
      ],
      "right": [
        "blocks.0.attention/output"
      ],
      "status": "suggested",
      "origin": "rule",
      "reason": "作用域位置、角色和静态调用结构对应；建议不是等价证明"
    },
    {
      "id": "match:blocks.0/residual1",
      "left": [
        "blocks.0/residual1"
      ],
      "right": [
        "blocks.0/residual1"
      ],
      "status": "suggested",
      "origin": "rule",
      "reason": "作用域位置、角色和静态调用结构对应；建议不是等价证明"
    },
    {
      "id": "match:blocks.0/norm2",
      "left": [
        "blocks.0/norm2"
      ],
      "right": [
        "blocks.0/norm2"
      ],
      "status": "suggested",
      "origin": "rule",
      "reason": "作用域位置、角色和静态调用结构对应；建议不是等价证明"
    },
    {
      "id": "match:blocks.0/mlp",
      "left": [
        "blocks.0/mlp"
      ],
      "right": [
        "blocks.0/mlp"
      ],
      "status": "suggested",
      "origin": "rule",
      "reason": "作用域位置、角色和静态调用结构对应；建议不是等价证明"
    },
    {
      "id": "match:blocks.0.mlp/x",
      "left": [
        "blocks.0.mlp/x"
      ],
      "right": [
        "blocks.0.mlp/x"
      ],
      "status": "suggested",
      "origin": "rule",
      "reason": "作用域位置、角色和静态调用结构对应；建议不是等价证明"
    },
    {
      "id": "match:blocks.0.mlp/gate_proj",
      "left": [
        "blocks.0.mlp/gate_proj"
      ],
      "right": [
        "blocks.0.mlp/gate_proj"
      ],
      "status": "suggested",
      "origin": "rule",
      "reason": "作用域位置、角色和静态调用结构对应；建议不是等价证明"
    },
    {
      "id": "match:blocks.0.mlp/up_proj",
      "left": [
        "blocks.0.mlp/up_proj"
      ],
      "right": [
        "blocks.0.mlp/up_proj"
      ],
      "status": "suggested",
      "origin": "rule",
      "reason": "作用域位置、角色和静态调用结构对应；建议不是等价证明"
    },
    {
      "id": "match:blocks.0.mlp/silu",
      "left": [
        "blocks.0.mlp/silu"
      ],
      "right": [
        "blocks.0.mlp/silu"
      ],
      "status": "suggested",
      "origin": "rule",
      "reason": "作用域位置、角色和静态调用结构对应；建议不是等价证明"
    },
    {
      "id": "match:blocks.0.mlp/gated_product",
      "left": [